{
  "p": "Ð:MP",
  "v": "1.0",
  "op": "bid",
  "inscription_id": "aaaabbbbccccddddeeeeffff0000111122223333444455556666777788889999i0",
  "price": "1200000000",
  "currency": "DOGE",
  "bidder": "DRPLkFEt5GNQR2xt1GtVBSsTUr63W3mBnq",
  "bid_fee": "100000000",
  "fee_recipient": "D9p4Lk9xvbQ2Dyh4S8vCb9Ly8cY3h8pP1M",
  "expiry": 1700010000,
  "chain": "dogecoin",
  "ts": 1700000500
}
